{
  "$schema": "https://json-schema.org/draft/2020-12/schema",
  "$id": "urn:speculo:ops:target-profile:v1",
  "title": "Ops Target Profile",
  "type": "object",
  "required": ["schema_version", "artifact", "scope", "project_id", "change", "created_at", "operation_mode", "environment_class", "deployment_root", "existing_state", "identity_confirmed", "identity_confirmation_evidence", "identity_assertions", "ownership", "differences", "secret_requirements", "readiness", "blockers"],
  "properties": {
    "schema_version": {"const": 1},
    "artifact": {"const": "ops-target-profile"},
    "scope": {"enum": ["global", "project"]},
    "project_id": {"type": ["string", "null"], "pattern": "^[a-z0-9]+(?:-[a-z0-9]+)*$"},
    "change": {"type": "string", "pattern": "^[0-9]{4}-[0-9]{2}-[0-9]{2}-[a-z0-9]+(?:-[a-z0-9]+)*$"},
    "created_at": {"type": "string", "format": "date-time"},
    "operation_mode": {"enum": ["audit", "takeover", "fresh", "release", "upgrade", "rollback"]},
    "environment_class": {"enum": ["local", "shared-nonprod", "production"]},
    "deployment_root": {"type": "string", "minLength": 1},
    "existing_state": {"enum": ["absent", "present", "unknown"]},
    "identity_confirmed": {"type": "boolean"},
    "identity_confirmation_evidence": {"type": ["string", "null"]},
    "identity_assertions": {"type": "array", "items": {"type": "object", "required": ["id", "provider", "key", "comparison", "expected", "evidence"], "properties": {"id": {"type": "string", "pattern": "^ID[0-9]{3}$"}, "provider": {"type": "string", "minLength": 1}, "key": {"type": "string", "minLength": 1}, "comparison": {"enum": ["exact", "ordered-list", "set", "digest"]}, "expected": {"anyOf": [{"type": "string", "minLength": 1}, {"type": "array", "items": {"type": "string", "minLength": 1}, "minItems": 1, "uniqueItems": true}]}, "evidence": {"type": "array", "items": {"type": "string", "minLength": 1}, "minItems": 1, "uniqueItems": true}}, "additionalProperties": false}, "minItems": 1},
    "ownership": {"type": "object", "required": ["owned_targets", "protected_targets", "unknown_targets"], "properties": {"owned_targets": {"type": "array", "items": {"type": "string", "minLength": 1}, "uniqueItems": true}, "protected_targets": {"type": "array", "items": {"type": "string", "minLength": 1}, "uniqueItems": true}, "unknown_targets": {"type": "array", "items": {"type": "string", "minLength": 1}, "uniqueItems": true}}, "additionalProperties": false},
    "differences": {"type": "array", "items": {"type": "object", "required": ["id", "target", "classification", "evidence"], "properties": {"id": {"type": "string", "pattern": "^DF[0-9]{3}$"}, "target": {"type": "string", "minLength": 1}, "classification": {"enum": ["expected", "safe-reconcile", "requires-backup", "ownership-conflict", "unknown"]}, "evidence": {"type": "array", "items": {"type": "string", "minLength": 1}, "minItems": 1, "uniqueItems": true}}, "additionalProperties": false}},
    "secret_requirements": {"type": "array", "items": {"type": "object", "required": ["key", "source_ref", "presence_required", "version_ref"], "properties": {"key": {"type": "string", "minLength": 1}, "source_ref": {"type": "string", "minLength": 1}, "presence_required": {"type": "boolean"}, "version_ref": {"type": ["string", "null"]}}, "additionalProperties": false}},
    "readiness": {"enum": ["blocked", "ready"]},
    "blockers": {"type": "array", "items": {"type": "string", "minLength": 1}, "uniqueItems": true}
  },
  "allOf": [
    {"if": {"properties": {"scope": {"const": "global"}}}, "then": {"properties": {"project_id": {"const": null}}}},
    {"if": {"properties": {"scope": {"const": "project"}}}, "then": {"properties": {"project_id": {"type": "string"}}}}
  ],
  "additionalProperties": false
}
